{
  "title": "Lou Gehrig Fan Club",
  "description": "Honoring the legacy of Lou Gehrig and supporting the ALS community",
  "contactEmail": "contact@lougehrigfanclub.com",
  "socialLinks": {
    "twitter": "https://twitter.com/lougehrigfanclub",
    "facebook": "https://facebook.com/lougehrigfanclub",
    "instagram": "https://instagram.com/lougehrigfanclub"
  }
}